Id,Reviewer_Id,Title,Review,Date,Rating
60662e19f85d750870435050,60662e12377f4a00198110cb,We received the wrong burgers and no…,We received the wrong burgers and no southern fried chicken when we rang up deliveroo they said we had to wait 48 hours for someone to help. Also the food we received came cold and we didn’t enjoy it for the price we paid. Wouldn’t recommend ordering from here.,2021-04-01 20:33,{1: 'Bad'}
606615bef85d75087043229a,5fa8730f23b4e4001abf3335,These delivery riders both moped and cyclists need training using public highway,"These delivery riders both moped and cyclists need there bloody heads examined they are both a danger to themselves and other road users, I am a bus driver and the amount of close calls I’ve had and no apology only get the riders sticking middle finger up and ride on",2021-04-01 18:49,{1: 'Bad'}
60661400f85d750870431efb,5694a8670000ff0001fb6e98,Avoid using them ..,"Avoid using them ..Placed an order on , they pretended that delivered but food never arrived",2021-04-01 18:42,{1: 'Bad'}
6066033ef85d75087042f7dc,60660334377f4a001980fc8d,AVOID,AVOID! I placed an order from Morrisons but the wrong goods were delivered. They offered a credit. I started a live chat to request the correct items to be delivered. The first agent to read it ended the chat. The second one offered a refund and refused to replace the items. Annoying becuse the items that were wrong were the ones I really needed. I had to order a load of stuff that I didn't really need to make it up to the £15 limit. Complete waste of time. First time using the app and it will be the last.,2021-04-01 17:30,{1: 'Bad'}
6065d7fcf85d750870428970,6065d71db64400001907165d,Overall a decent experience,Overall a decent experience. Full repect to the riders who are out at all hours rain or shine. 4 out of 5,2021-04-01 14:26,{4: 'Great'}
6065c5def85d750870425bed,5aba4b3c4de5666d3427dd36,Outrageously expensive and a rip-off!,Outrageously expensive and a rip-off!The prices that are charged are outrageous and excessive and I am sure that this is just commission paid to Deliveroo. Why are they still allowed to operate during Covid when most people are not even allowed to work? Also when are the Americans going to understand that we in Europe like to exercise and do not need everything delivered to our door! Do not ever use this company you only need read the reviews and see their trust pilot score! I have never felt so robbed!,2021-04-01 13:08,{1: 'Bad'}
6065607df85d750870417afc,60656075e3c5e0001ae11f54,Orderd a meal through deliveroo with a…,"Orderd a meal through deliveroo with a restaurant that uses their own delivery drivers. After an hour and 45 minutes of waiting (which I sat by the window 10 minutes prior to delivery time so I could watch for them) I  contacted deliveroo through their live chat and was told that she had spoken to the Gold Moon and the food would be with me in 5 mins. So 5 mins later I phoned Gold Moon myself. It seems they travel in a tardis to make their deliveries. I was told by a very rude and unhelpful man that the driver had in that 5 mins drove to my address, tried to contact me, then drove back to the restaurant and explained what had happened before I rang. Quite a miracle as its a 15 min round trip.I contacted deliveroo by email and attached screenshots of all communication and call logs which quite clearly prove the driver could never have been here. The next day I called deliveroo who were about as useful as a chocolate tea pot. The woman I spoke to had no interest in trying to help and just kept banging on about having to speak to the restaurant as they did their own deliveries. They needed to ask whether the food had been delivered according to them. Well of course they're going to say it has you dozy mare! And surprise surprise I received an email saying the restaurant had confirmed they had tried and therefore I wasn't entitled to a refund.Turns out the place has a reputation for taking payments and not delivering the I've since found out when I googled them. There are many reviews saying the same thing. In hindsight I should have payed more attention to the rating before I ordered. Then again you wouldn't expect a company as big as deliveroo to allow scamming, thieving businesses to trade through them.Anyway I contacted my bank and disputed the payment and got my money back. Banks nearly always side with their customers with no quibbles for any online purchase made.",2021-04-01 05:56,{1: 'Bad'}
60651398f85d7508704152cf,5ec6ef9bc66da380578afe7d,Well done to Deliveroo,"Monday had been  first experience with Deliveroo, I had no idea they shopped for customers.All went well, arrived in their slotted time and packed well",2021-04-01 00:28,{5: 'Excellent'}
6064e367f85d750870412428,5c55ae675abbd08ad1e5c43b,Worst custermer service would never order again,"I tried to use their introductory code to get £10 off, this displayed in the total at checkout in the total. Then got the order confirmation stating that we were being charged the full amount, immediately tried to cancel (less than 5mins later) the order but was informed they could not as the order had been processed. Contacted the live chat and got the worst customer service I have ever experienced. Told sorry for the inconvenience and they would pass on my complaint. Will never order from them again. Food did arrive quickly.",2021-03-31 21:02,{1: 'Bad'}
6064da74f85d750870411386,6064da69b64400001906a0a4,Dear Deliceroo,Dear Deliceroo. I am one of your rider.Please stop fooling me with you pay £5.99 for One delivery and £6.79 for 2 deliveries you sneaked in. Lots of drivers I know this you trying to trick us and CANCEL The second order. Good Luck,2021-03-31 20:24,{1: 'Bad'}
6064cab4f85d75087040f0a3,6064caad32d688001a8e0088,I ordered from Kaspas through Deliveroo…,"I ordered from Kaspas through Deliveroo and the ordered turned up half full.I rang Kaspas first who were not helpful at all,so I went on live chat to deliveroo They were less than helpful and ended the chat saying I hadn't responded quick enough.I tried again and was told there was nothing they could do.I will not be using them ever again.",2021-03-31 19:17,{1: 'Bad'}
6064c864f85d75087040eb42,5ace01644de5666d344f2de9,"Predatory unscrupulous company, don't use!","I just found out from a local restaurant that I order from a lot via Deliveroo, that they've been charged 54% commission by Deliveroo and they shared a copy of the invoice that proves it. This is below their costs, and means they’re actually loosing money to work with Deliveroo, who have so far refused to deal with them and even suspended their account for complaining. Looking on the internet there are various articles showing this is not an isolated case by some rogue employees or a coding error, but their actual business model during the pandemic. Whilst they know that many restaurants have no other route to market and are desperate, they’re just charging very high commission rates, knowing full well these companies are on their knees and unable to fight back. Without these partner companies, Deliveroo is nothing but this is how they treat them during a national crisis. And it gets worse, they also regularly see which restaurants are most successful in a given area and copy their menu with minor tweaks operating out of industrial units with their own ""exclusive brands"", so they can steal their market share as well as charge high levels of commission. Clearly this is to try and bolster profits prior to their up-coming IPO, but at what cost, effectively extorting small businesses who cannot fight back, absolutely disgusting and predatory. And reading other reviews here, I guess unsurprisingly they treat the riders poorly too.I've cancelled my premium account today and deleted the app and shown this to everyone I know, this kind of abusive way of running businesses makes me sick and I want no part of it. I'll be going direct to local restaurants on the phone from now on. And I really hope more people will wake up to this company and delete the app.",2021-03-31 19:07,{1: 'Bad'}
6064be53f85d75087040d3f4,58e8103d0000ff000a8ae8bc,Meal spilt.,"Ordered a meal. When it came it had been turned upside down at some point. The curry sauce had leaked all over everything and through the bag. The burger and all it's contents spilt all over the bag. I showed the driver, he said he didn't speak English, he took a photo of the meal and said he would reorder it. Half an hour later I tried to contact deliveroo to find the ""help"" facility only works on their latest download. As I only downloaded the app a few weeks ago I thought I would have had the latest version? I then contacted the shop who said no reorder had been received. They were however, able to give me a contact number for deliveroo. I called and spoke to an (American) woman who said she would arrange for a reorder. Still waiting........",2021-03-31 18:24,{1: 'Bad'}
6064b602f85d75087040becf,5b0592964de5666d343c9ea7,Got an item that was incorrect in my…,Got an item that was incorrect in my delivery but they refunded the full cost of the item. Quick delivery as well.,2021-03-31 17:48,{5: 'Excellent'}
60647feef85d750870402c76,60647faae02941001b60383e,Deliveroo stole £30 from me,"I haven’t used my account in a while but was gifted a 30 pound voucher for my birthday so I logged in and added the gift voucher and intended to buy a meal. The order wouldn’t process and so I contacted customer support, they informed me that my account had been deactivated because I made a claim in 2018 for spilled food and this was a breach against their refund policy. The gentleman ‘Christopher’ on the phone was very rude and would not let me speak. He has now ended the call telling me that my account is closed and they will not refund me the 30 pounds. Absolutely ridiculous that they think this is Ok to steal £30 from me and close my account without warning. Will not be using Deliveroo ever again and strongly recommend everyone does the same.",2021-03-31 13:58,{1: 'Bad'}
60647c3af85d7508704023d0,54903adc00006400019df9f8,Unscrupulous Company.,"No wonder their share price has plummeted on the stock exchange. Even the City of London's biggest money managers — including Aviva, Aberdeen Standard Life, and M&G have publicly said they will not take part in Deliveroo's IPO because of the appalling treatment of their drivers. How can they justify charging £3.50 or more for delivery plus an extra 5% service fee  of the bill total on top of that when they pay their drivers an average of £2 per hour. Disgusting behaviour.",2021-03-31 13:42,{1: 'Bad'}
60647433f85d750870401058,58b441470000ff000a7bf7cd,Absolutely rubbish delivery company,"Absolutely rubbish delivery company, it treats its drivers with utter disdain, offer worst pay rate. Most city delivery partners use multiple apps to cover their mileage, Deliveroo is ending their contract with impunity, classic case of modern day slavery. JUSTEAT and UberEats are much better than them.",2021-03-31 13:08,{1: 'Bad'}
6064705df85d750870400750,5fd359ddb988f2001baa778a,WARNING,"WARNING: ordering a take away from Deliveroo makes you complicit in criminal activity.Deliveroo’s business model requires it’s bicycle and e-scooter transported staff to drive illegally and recklessly on pavements and through zebra crossings and red lights, putting at high risk pedestrians, children in prams, wheel chair users.These vehicles carry no identification so the perpetrators can not be identified. Aid and abet this criminal activity at your own risk.",2021-03-31 12:51,{1: 'Bad'}
60646485f85d7508703fea29,5eeb306b9cd5e391d12ca273,The most pointless customer service…,The most pointless customer service I've ever dealt with. They showed absolutely no support with my claim and instead replied multiple times with scripted answers. USELESS.,2021-03-31 12:01,{1: 'Bad'}
60646008f85d7508703fdf28,5a2c015b0000ff000aeeaabf,Never again!,"Terrible cold food, dreadful customer service. This business is rubbish. It won't be long before it goes under!",2021-03-31 11:42,{1: 'Bad'}
60644ea3f85d7508703fb2f9,5b4fbc074de5666d3490276c,Zero customer service,"Zero customer service - what an utter waste of time they are. I continually have missing or incorrect items, instead of them flagging this with the store in question, you are flagged on their systems and you can't get your money back, or the food. When you call, they give you a standard response, when its escalated you get the same standard response. shocking",2021-03-31 10:27,{1: 'Bad'}
60643e91f85d7508703f8b96,5d400676af37c4328e4ecc40,Beyond Appalling Customer Service,I would really give no stars at all. Their customer service has been appalling. Having offered £10 discount for a new customer - they refused to honour this as my daughter paid on her card for my meal as a present! She is already a customer.  They have now lost both of us and we will return to Just Eat if needs be.,2021-03-31 09:19,{1: 'Bad'}
60642fc8f85d7508703f6b60,56cdb5440000ff000a090d77,Zero customer service,"Zero customer service, missing items and you can't get your money back, or the food. You can't contact the restaurant and the rider doesn't give a....Deliveroo plus is a scam.I want my money back and won't order from deliveroo again.",2021-03-31 08:16,{1: 'Bad'}
6063a7a2f85d7508703efc9e,5f4ebe28feddbcc71fe17f61,Deliveroo Plus is just a scam,"Deliveroo Plus is just a scam. Forgot to cancel your free trial? They will quietly charge your card monthly, without sending a single receipt. Just found out they've been charging me for over a year! £150+ paid to Deliveroo for absolutely no service received. Working as intended. You didn't just lose a customer, Deliveroo - you've gained an enemy.",2021-03-30 22:35,{1: 'Bad'}
6063a519f85d7508703efa49,5b6c13124de5666d34f9045a,Worst company ever,"Absolute crap, promotions/codes NEVER work despite meeting all criteria.Added the 10 off 15 order code fine, I made an order, starting to feel happy and look forward to my treat meal, gets to checkout and lets me click pay, to THEN bloody tell me the discount is conveniently not valid and will be removed from my account. Disgusting, thanks for nothing",2021-03-30 22:24,{1: 'Bad'}
60639944f85d7508703eed40,5f53c98431af83c658cbc02c,This is the worst delivery service I've…,"This is the worst delivery service I've ever used and will never touch it again.They advertise credit off your first order to sign you up, the code doesn't work because I don't meet the criteria but I'm a brand new customer who has never used deliveroo. Then you ring customer care for over an hour to get it resolved.First order and last order from thus disaster of a company,Avoid these at all costs absolute joke of a company.",2021-03-30 21:33,{1: 'Bad'}
60638a9df85d7508703ed69b,600747059d30290019b8fb10,Things go wrong from time to time,"Things go wrong from time to time, what matters is how they are fixed.  App showed the delivery driver around the corner, then food as delivered.  But it wasn't.  Went on live chat, and after a few expected questions to confirm my ID etc. they arranged a new delivery.  No fuss, just sorted it.  Took less than 5 minutes to get sorted.  I'd love to know the delivery drivers explanation of what he did with the first meal though.",2021-03-30 20:31,{4: 'Great'}
6063889af85d7508703ed2c6,5a1306ea0000ff000ae53c87,AVOID UNLESS YOU'RE ON A DIET,"I ordered KFC via deliveroo at 6.50 and received an email stating that my food would be delivered between 7.05 and 7.20. Checked the tracker and the delivery time kept being extended until it eventually told me the food had been delivered at 8.57. It possibly had been delivered, just not to me. Rang the help line who didn't even apologise but said they would refund me in 24 to 48 hours which leads me to believe this is regular occurrence. Plus I still haven't got any food.",2021-03-30 20:22,{1: 'Bad'}
606370e3f85d7508703ea147,5b71f45f4de5666d3465db61,Deliveroo is a disaster,Deliveroo is a disaster - how can a company that gets EVERYTHING wrong end up listing for millions. They cant delivery hot food.They cant deliver to the right address and they cant even get their website to work on the simplet details such as an address?!!. Totally useless and the only recommendation I can make is avoid them at all costs =- Waste of time.,2021-03-30 18:41,{1: 'Bad'}
60634911f85d7508703e3b0d,5f3966865b531d69065e492a,Appalling Customer Service,"While the service received from some food establishments is not very good, the customer service from Deliveroo is virtually non existent.Having used the service once and having had need to raise a complaint regarding the lack of customer service, I was refunded a grand total of £3.69, later after deciding that I was not going to use the service again, I requested a refund and despite receiving an email to say that the £3.69 had been processed, only £1.28 was refunded with the remainder applied as an expired credit to the account. Trying to get any decent response from them was hard, with the explanation given that it was a system generated response and that ""We hope you'll enjoy your Deliveroo experience more next time."" yeah right",2021-03-30 15:51,{1: 'Bad'}
60633027f85d7508703df5be,566601b80000ff0001f12997,"Would not recommend, when things go wrong they go wrong","I have only used this company for the 2nd time.  Upoon doing so, i ordered a Nandos meal where they forgot over half the order.  I then called Nnados, who said i need to call deliveroo, after finding out how to do so, i was speaking for a good while to get this sorted, in the end i was told i would get a fulll refund of my order, which seemed great, but they have now only partly refunded and I am now chasing this up back and forth.  Edit: So turns out my full refund has been issued part in cash and part of the voucher i used to get my order, so in they end they still keep some of my money and no way to contest it.  Uber Eats please forgive me, i will never stray again.Would not recommend, when things go wrong they go wrong",2021-03-30 14:05,{2: 'Poor'}
60632900f85d7508703de51f,606328f926ed8a0019e5fb7d,Good Cust Service Rep,"I had to contact custom service today since,based on previous deliveries, I had to notify some reoccurring actions from the riders.Anne Kristine not only notified that but also escalated the issue in a professional and efficient manner",2021-03-30 13:34,{4: 'Great'}
6062fe00f85d7508703d8036,6062fd462d361e0019c826c6,WORST customer service,WORST customer service. never using again. no delivery and waited over an hour after it was supposed to arrive. terrible company. embarrassing!,2021-03-30 10:31,{1: 'Bad'}
606256eef85d7508703cce8b,5b770afc4de5666d341c0776,Would be less stars if possible,"Would be less stars if possible. Ordered tonight, money taken at 10:30, message to say it was on its way, then one to say delivered but it never arrived, and was told by the restaurant when I called them it had closed. Was told I’d get a refund but no interest in the lack of service or the fact a driver marked as delivered when he hadn’t even collected order. Shocker",2021-03-29 22:38,{1: 'Bad'}
60623a3cf85d7508703ca715,60623a1a80fee0001ae692ee,SCAM!!!!,SCAM!!!!I ordered food and one item did not arrive. I then contacted deliveroo and they only game me credit so that I would have to order from them again instead of a refund. VERY BAD,2021-03-29 20:36,{1: 'Bad'}
606221b3f85d7508703c730e,5d73f4f179586ed7bad49d52,Very very disappointed bad service,,2021-03-29 18:51,{1: 'Bad'}
60621c3af85d7508703c6610,6048f3fed80c1f0019cdac62,Terrible service hope this poor excuse…,"Terrible service hope this poor excuse app business goes out of business quicklyTerrible service, don’t honour delivery times or food quality. Do not honour voucher or promotions. Over inflated prices of food compared to ordering directly. The company is going through an ipo. I wouldn’t value this company even at 1p based on their service. Hope it goes bust with immediate effect",2021-03-29 18:28,{1: 'Bad'}
6061cf91f85d7508703b9c5a,6061c88b914679001a53fa5a,Poor experience,Poor experience. food was late and cold.,2021-03-29 13:01,{2: 'Poor'}
6061c791f85d7508703b877f,6061c78bcf525e00197b12e1,They deserve zero !!!!,"Working a night shift at a hospital I thought I'd order through Deliveroo. I missed a call and in exactly 3 minutes I called back. It wouldn't go through and when I contacted customer services it said it was left at the 'concierge'. Most of the hospital is closed and we don't have a concierge. They refused to tell me where exactly the food was left, no picture of where it was left, no refund or redelivery. Customer service wasn't helpful at all even though I contacted them through the app, and by email. I would give this ridicolous company 0 stars if I could.",2021-03-29 12:26,{1: 'Bad'}
6061bc77f85d7508703b6b99,5da99d9721b2e205d5e389a3,Poor service-cold food and kept chasing for our order,"Very disappointing we order our food to treat ourselves for our wedding anniversary on the 22 March not only did the food come very cold but we had to chase for our order twice we eat at 10 pm. During the live chat after explaining to the person, within 2-3min the person left the chat.I would never recommend Deliveroo to anyone",2021-03-29 11:39,{1: 'Bad'}
6061b978f85d7508703b6491,50964434000064000125e379,Absolute rubbish,Absolute rubbish. Our right is to get a refund not a credit note.Got a complaint with deliveroo then take it to resolver.co.uk  don't waste your time on their lying chat service.They also had a cheek to send out email asking if you want to buy shares???  What a joke!,2021-03-29 11:26,{1: 'Bad'}
60619ecef85d7508703b21c6,59a522ba0000ff000ac162fd,Hopeless company,Hopeless companyWould never ever order again from themI ordered kfc on Saturday and paid . They came back 15 minutes later and said could not accept order. No reason given.My payment was taken right away and the refund will not go on my account for days.They have now said it was because kfc have a 10 minute time slot  and could not fulfil it. I contacted kfc and they said it was nonesense.Avoid this company like the plague.,2021-03-29 09:33,{1: 'Bad'}
6061281ff85d7508703ab0c5,6061257fd0a67f001978a2b7,I'm happy with them,"idk, maybe it depends on the place you are, but I was always happy with them",2021-03-29 01:06,{5: 'Excellent'}
6060eb53f85d7508703a86f9,5ff8454f7682a8001a70624f,First and last order,"First and last order. Deliverpoo mate, ordered from Gbk waited a hour for the drivier to not deliver my FOOD. Carlos R never didn’t even ring or ring the buzzer to my flat absolute joke. Restaurant is now closed and Deliveroo won’t refund with it being my first order what a load of sh*te that is ha. Thanks again deliverwhooooooo",2021-03-28 20:47,{1: 'Bad'}
6060d462f85d7508703a6980,5e808eb95409e819dd6e752f,Fine sometimes but customer service…,"Fine sometimes but customer service whilst being polite rarely do anything to rectify late / cold / missing items. If an item doesn't arrive they'll refund you with store credit that expires in 3 months, instead of providing a cash refund. Super shady business tactics.",2021-03-28 19:09,{2: 'Poor'}
6060c732f85d7508703a55c2,5aa972944de5666d34d4a5e9,Deliveroo is probably the least…,"Deliveroo is probably the least reliable delivery service going. One minute restaurants are available, the next they’re not. Orders getting lost constantly or horrifically late. Orders turn up cold or in an absolute jumbled mess. I’ve put up with it for so long as everybody has bad days but enough is enough, sick of getting the worlds worst service!",2021-03-28 18:13,{1: 'Bad'}
606045d9f85d7508703992ab,59d37bf10000ff000ad067cc,Worst ever,Worst ever . Food never arrived . Waited patiently half hour and then nothing . The driver called me saying that he was in front of a ship ? Yeah my ax!. All I got out of this was a voucher to use again on their site !,2021-03-28 09:01,{1: 'Bad'}
605fdbf5f85d7508703956d5,605fdbedd0a67f00197810e2,Deliveroo are thief’s,"Deliveroo are thief’s. They didn’t deliver my order and charged me the full amount. They told me it is not possible to get a refund. Absolute thief’s, with the worse customer service!",2021-03-28 01:29,{1: 'Bad'}
605fa6f0f85d7508703935ae,605fa4989645d1001979d5ae,Deliveroo Romford- food not arrived!!,"So it is the night of my brothers 21st, at 9:20pm at night. My mum spent £75 on nandos and accidentally typed the wrong address on her order (delivered to her work address) she realised a second later. All night we was trying to contact deliveroo, nandos, deliveroo driver NO ANSWER! She spoke to someone on live chat who said message the deliveroo driver on the live chat when picking up the food. No answer. My brother had to go out on his 21st birthday to my mums work to collect a takeaway only when we got there there was no deliveroo driver there. We checked around the building no food to be seen. The deliver too drivers name was Daniel. He should be sacked! Scumbag!! Couldn’t deliver to our address which is 7 minuites away! They offered a refund but by this time we are all starving! We will not be using deliveroos service again!! We are food deprived we need to eat! A refund didn’t even justify our hunger. Uber eats is so much better. Deliveroo are rude, unprofessional and crap!!!",2021-03-27 21:43,{1: 'Bad'}
605fa63bf85d7508703934ff,5f26dc23158ac8b0b1cd3aed,Absolutely rubbish,Absolutely rubbish. I don’t blame the Deliveroo drivers at all.. clearly it is the company at fault. Regularly delivered either cold food or wring order!!,2021-03-27 21:40,{1: 'Bad'}
