Id,Reviewer_Id,Title,Review,Date,Rating
605fa373f85d750870393215,604d3f092b4e34001f134e62,DO NOT USE DELIVEROO!!!,Just realised what poor ratings this company has.... not surprised! Rider did not arrive with food. On-line chat tried to tell me he came so I am not eligible for a refund... what part of ‘I didn’t receive my food and I was standing outside my front door waiting for him’ do they not understand!! Thought these guys use GPS trackers?? Perhaps they think I should roam the streets looking for my order! I made sure the location was exact on the ordering app and I was stood waiting for him as he approached my street. Deliveroo then said they would not give me a refund. I will now be taking legal action. They should be regulated and closed down. First and last time I ever use them.,2021-03-27 21:28,{1: 'Bad'}
605f9beff85d7508703929f2,4f9d655f00006400011875a4,I never have any problems with…,"I never have any problems with Deliveroo, and use them at least once a week. Excellent service and great app.",2021-03-27 20:56,{5: 'Excellent'}
605f9824f85d75087039258c,605f97932f9b2c00197e19c1,Delivery drivers usually hate to bring…,Delivery drivers usually hate to bring your order up to you (if you live in an apartment building),2021-03-27 20:40,{1: 'Bad'}
605f9762f85d75087039248e,4fe24d6a00006400011b9fe0,Very disappointing!!!!,"I order 3 items from cedar lounge in st. johns wood  on Sunday 27/03 at 19.00 and the order came at 19.48 but only one item of the three of the items I originally ordered came. I phone Cedar lounge and they told me I had to call Deliveroo, then I called Deliveroo and they only offer a £2.50 credit on my next order!! And I have to wait twice for the same delivery!!!!!This is an appalling customers service! I expect a lot more from a company who is making millions from lock down!!!! I have no words to describe how disappointed i am with Deliveroo. Will do MY BEST to spread the word! Thank you Deliveroo for the unacceptable cock up!",2021-03-27 20:36,{1: 'Bad'}
605f93b6f85d750870391fbb,605f93b1d0a67f001977f972,BYRONS LIVERPOOL,"BYRONS LIVERPOOLAmazing food and 10/10 customer service. Cute message on our food, free doughnuts  on them! Along with a complimentary glass coke and a smile all for such a reasonable price.100% can’t wait to eat inside",2021-03-27 20:21,{5: 'Excellent'}
605f8f5df85d7508703919f5,5e8d9b9a6251456b37ed292e,CRAP nothing else to say!,,2021-03-27 20:02,{1: 'Bad'}
605f86c0f85d750870390e50,5ebea569ee8f290029d1e229,I just had a order from Butta Burger…,"I just had a order from Butta Burger ,Edinburgh.  Was very quickly and delicius!",2021-03-27 19:25,{4: 'Great'}
605f7c59f85d75087038fe7a,59357f140000ff000aa0179a,Fell at the first hurdle,"Just tried using Deliveroo for the first time, they flagged both my debit and credit cards as fraudulent transactions. Got fed up trying so swapped to Just Eat but of course my cards were now flagged as inactive.I'm never ever going to use Deliveroo again.",2021-03-27 18:41,{1: 'Bad'}
605f720af85d75087038ec82,60577f7836087e001b4a7240,Very very bad service,"Very bad service, my order was cancelled as the driver didn’t want to travel 6miles because a road was closed. I reorder and they charged me twice to deliver. Spoke to customer service and he was arguing with me and was refusing to refund me. Closed my account and will not be using them again!!!! Really bad customer service!",2021-03-27 17:57,{1: 'Bad'}
605f6cbcf85d75087038e3b9,5c47228cd201f7bf66205372,Generally good food and quick delivery,"- Generally good food and quick delivery in my area.- Nice tracking of your order in their in app map and ability to leave driver instructions. - Obviously, you can't expect food to be piping hot like being in an actual restaurant, but nothing a quick oven blast/reheat can't fix.- If there is errors/something wrong such as missing or wrong items/cold food etc, ability to chat with someone in the app is generally good, and they have always provided me with a reasonable credit/refund back into my account.- Most negative reviews seems to be on the restaurant/takeaway/shop side of things rather than the middle man service that Deliveroo provides.",2021-03-27 17:34,{5: 'Excellent'}
605f5ca3f85d75087038c68c,5bb4a8574de5666d341177e0,Really bad experience!,Really bad experience. Deliveroo are just straight con artists and do not want to honour specific deals from there retailers especially when you’ve paid the costs. Then they say it’s the retailers fault not ours. Avoid and use Ubereats instead!,2021-03-27 16:26,{1: 'Bad'}
605f563bf85d75087038ba0b,5da64b393a4256a5983f2d78,Disappointing customer services answer…,"Disappointing customer services answer to when your food doesn't arrive but it states, 'delivered' is to blame you the customer for not ensuring the map PIN is correct even tho I leave clear directions in the notes for all couriers & how is it couriers usually (daily) find my ground floor flat but today (Saturday 27 March 2021) this particular courier can't read instructions & has the audacity to report my food as delivered! Where did my food go!?! Presumably the courier had my food for his teabreak. In any event, after trying to fob me off with a credit to my deliveroo account I requested a full refund to my card as its unlikely I'll be using deliveroo again. Disappointing. I won't be recommending deliveroo to anyone anytime soon.",2021-03-27 15:58,{1: 'Bad'}
605f4f0af85d75087038ad21,605f4f03d0a67f001977d83d,Happy with deliveroo,"Firstly, I think too many people had poor experience with restaurants/drivers and not the app itself, and this is the reason of so many poor reviews. I use deliveroo regularly and yes, sometimes mix ups happen, sometimes food is a little bit late or cold. But, no matter what the issue is, Deliveroo customer service always does its best to make sure it's resolved and that customer (me) is happy.",2021-03-27 15:28,{5: 'Excellent'}
605f18ddf85d7508703848ef,5fedbb0f83e36400191f367d,Worst customer service I’ve ever…,"Worst customer service I’ve ever experienced (and I’ve worked in luxury retail for 10 years). The food arrived uncooked and completely different to how it was described and pictured. The customer service team only offered 50% compensation of the order amount even though I’m fully within my legal right to receive full compensation. No calls accepted at this time so had to do a live chat which was dealt by what seemed to be dismissive angst teens. Then went on to further complain to their support email they gave me, to which was dealt with in the same way. None of these incompetent people deserve a job. Do not use if you want an enjoyable meal, go fetch it yourself.",2021-03-27 11:37,{1: 'Bad'}
605f0437f85d7508703825b3,54ec6fc60000ff0001ad33b4,I have never dealt with such a bad…,"I have never dealt with such a bad customer service in my entire life! My pizzas took very long time to arrive, way above their estimated time. The driver was late picking it up from the restaurant in the first place so they had to re make all 4 pizzas and yet he still managed to get lost en route to me and delivered 4 completely cold and ruined pizzas. Apparently I'm only entitled to half of my money back. When I asked why, this rather strange answer was given: ""When reviewing orders/claims, there are several things we have to take into consideration. This means that we review each claim on a case by case basis and therefore the amount we offer in compensation may vary depending on a number of factors."" Needless to say, the 'factors"" were not explained at all. To me this is rather straightforward, my order was very late and arrived totally ruined. What else is there to consider?? !",2021-03-27 10:08,{1: 'Bad'}
605f0317f85d7508703823cd,605f027e2989d9001a62aa6e,Good half the time,"Good half the time, Bad the other half.Food is sometimes hot and sometimes cold. Drivers are sometimes on time and sometimes late.",2021-03-27 10:04,{3: 'Average'}
605eeb30f85d75087037fd92,4dbef64a00006400010829c0,Pizza delivery arrived cold as delivery…,"Pizza delivery arrived cold as delivery took 35 min on a bike as they delivered another pizza to another location in the opposite direction first, totally rubbish if you want hot food",2021-03-27 08:22,{1: 'Bad'}
605ee281f85d75087037f28d,601da8f480d0a30019877376,Brilliant service,"Brilliant service, had worst hangover ever, needed fry up, Deliveroo came found me, and delivered best breakfast for a long time.",2021-03-27 07:45,{5: 'Excellent'}
605eaaabf85d75087037d1f5,5e1e1426616781caa5810c78,I am giving 5 star for the deliveroo…,I am giving 5 star for the deliveroo customer service. I made an order via deliveroo and received a message saying my order was delivered when in reality it was no where to be seen. Contacted the restaurant first and it was of no help at all. Then I contacted the deliveroo customer service via webchat. The service I received was amazing. They refunded me and was very apologetic about the situation. My best experience ever with the customer service.,2021-03-27 03:46,{5: 'Excellent'}
605e9afff85d75087037ccad,605e9af39645d10019795b17,The actual delivery times are double of…,The actual delivery times are double of what is displayed on the app and customer service is very unhelpful.The app provides order tracking inconsistently. The customer is not prioritized. Customer Service is poor - they don't allow you to cancel the order after 30 seconds of placing it.,2021-03-27 02:39,{1: 'Bad'}
605e901cf85d75087037c870,605e90172f9b2c00197da73d,i’m not happy at all,"I’m honestly quite upset with the way your customer service is , we had been waiting for our order for around an hour and a half so we decided to call , the way we were treated was absolutely disgusting, we had the police threatened to be called and they blocked our number . The situation was  quite hostile  and honestly very disapointing , we are not happy at all and this has put us off of your company, 10/10 do not recommend!",2021-03-27 01:53,{1: 'Bad'}
605e6230f85d75087037a9ef,5f3f71803e39beb0325ef760,Wast of time and money,"Bad do not order from here!!!! We ordered our food at 8.45pm  and the food was ment to be here between 9.45pmand 10.20pm , The restaurant said it was preparing our order for over an hour not to bad as its Friday, our driver arrived at the restaurant only for our order to be canceled!!!! I have spoke to jane from customer service and and still waiting for a reply half an hour later !!! Not happy at all. Our money will be refunded in the next 24 to 74 hours f**king joke",2021-03-26 22:37,{1: 'Bad'}
605e5a64f85d75087037a0db,5fbd54fd44c93b001a517e29,Disgusted with service,Totally disgusted with service. 53 year old who unfortunately has no photo Id to buy alcohol. No passport and dont drive. Showed a letter from docs with my dob on but was refused. I can understand if I looked under 25 but my daughter is 34 so I was disgusted with not receiving my goods especially as half hour before a friend had no id but was told to just say her dob. Now I have to wait 8-10 days for a refund. We don't all go on holiday and have a passport and we don't all drive. To refuse someone treble  the age of lawfully buying alcohol is disgusting. First time using your company and  I will not be using you again. Reading the reviews below I wish I hadn't bothered. 17 pound out of pocket for 10 days thanks,2021-03-26 22:04,{1: 'Bad'}
605e5142f85d7508703794bb,5f10d9a8f5f33b01a043a200,Absolutely disgusted with the service,"Absolutely disgusted with the service. Ordered a birthday treat from Nando’s, £46 and 1.5 hours late we call to be told that the driver tried to deliver but no body was home and they have given our meal to the homeless !!!!!! and a refund request will take 7-10 days !!! So we order a birthday meal and then go on a jolly apparently !!!! Avoid at all costs !",2021-03-26 21:25,{1: 'Bad'}
605e4891f85d75087037878e,605e488b2f9b2c00197d8da8,So far I have been waiting 3 hours for…,So far I have been waiting 3 hours for my delivery. No option to contact the company through the app so I called the customer support number and got a response of well you can cancel the order if you don't want to wait.,2021-03-26 20:48,{1: 'Bad'}
605e4814f85d7508703786b1,5aa04ee44de5666d34337017,Coldest pizza/delivery EVER (Franco Manca),"Just received a delivery from Franco Manca, took 74mins to arrive and is stone cold. Literally never received a takeaway as cold as this!",2021-03-26 20:46,{1: 'Bad'}
605e4685f85d75087037842f,605e467c6a717e0019957ceb,If I could give it a zero star I would,If I could give it a zero star I would. 3 times in a row we’ve had our orders delivered 2 hours late and have had to have the restaurants prepare our orders from scratch because it was either delivered to the wrong place or just not delivered at all,2021-03-26 20:39,{1: 'Bad'}
605e41c1f85d750870377c37,5ae24cd54de5666d3471dc72,Missing items both times!,WOW! this is my second time of ordering with Deliveroo. Both times items were missing and this time the food was also cold. The first time they refunded me £1.50 for a portion of missing mushrooms and sweet potato fries.....really!! The mushrooms themselves cost me an extra £1 on their own. I won't be ordering for a third time that's for sure.,2021-03-26 20:19,{1: 'Bad'}
605e40ddf85d750870377a98,605cb15ead7256001bdc3948,A MILLION TIMES BETTER THAN UBER EATS,,2021-03-26 20:15,{5: 'Excellent'}
605e3b4cf85d750870377033,605e3b3ba42b24001a4dc89b,No order!!,We wait so long and we didnt get order! First and the last time we order by Deliveroo!,2021-03-26 19:51,{1: 'Bad'}
605e37e2f85d7508703769b0,5f771eb4ee97a605a6206236,Worst company,Worst company. Used a coupon and checked it was taken off before I accepted the payment. Then I checked the receipt and it is the full price. Contact the company immediately but their horrible customer service would not help me and I could not cancel the order. Do not use it!!!,2021-03-26 19:37,{1: 'Bad'}
605e2926f85d750870374ae8,601821f7455229001a65c0ef,Very good honour offers unlike ubar…,Very good honour offers unlike ubar eats who are big con job avoid,2021-03-26 18:34,{5: 'Excellent'}
605e129af85d750870371384,605e1292cb1564001aeca3aa,Missing items twice,Missing items twice. I had enough.,2021-03-26 16:58,{1: 'Bad'}
605dfe1df85d75087036da7d,5e106134b14ccfa830fab2e6,Will never use again...,"Took so long to deliver all the food was cold, complete waste of £28 - contacted them and were not interested.  This was the first and last time I use them!!",2021-03-26 15:30,{1: 'Bad'}
605df4a8f85d75087036c08c,5d01de24f371c64df7908ab4,"THIEVES, CUNNING, GREEDY,","A very greedy cunning thieving company, I thought I was subscribing to free trial, I find out later it wasn't free trail, then the subscription payment was taken in seconds from my account instead of end of the month like most companies. This company is a penny thief, they want to squeeze out every penny from you be it in a cunning fashion. They are not like ubereats where your refunded or problems resolved instantly. Deliveroo is very different, it doesn't really focus on customer satisfaction, they are going public, don't buy thief stocks because as soon as lock down is over they companies valuation  will half, so your shares will half and you will loose money, buy shares in a few months when it's gone down by few hundred percent. They are offering customers shares pre listing but either way its about to loose money so the customers loos hugely. CAREFUL WITH DELIVEROO ITS A CUNNING THIEVING COMPANY FRO. EVERY ANGLE.",2021-03-26 14:50,{1: 'Bad'}
605de5e1f85d7508703696bd,605de5db31c2db0019392da9,just order food from Deliveroo my goods…,"just order food from Deliveroo my goods arrived excep the desert cost £2.00 they would not refund me AT ALL RUNG SPOKE TO CUSTOMER SERVICES PASSED TO PILLAR AND POST THEY TERMINATED MY CALL AS WLLIT MAY BE ONLY £2 FOR NON DELIVERY OF MY DESERT, THEY WOULD NOT ENTERTAIN THAT WE HAD NOT RECEIVED THE GOODSNO CUSTOMER SERVICES AT ALL, TREATED ME LKIKE AN IDIOTDO NOT BUY ANYTHING FROM DELIVEROO!!!IF IT DOES NOT ARRIVE YOU WILL NOT BE REFUNDED",2021-03-26 13:47,{1: 'Bad'}
605dc8cdf85d750870363847,5bd848b04de5666d34607283,I had covid and they stole from me,I had covid and they stole from me. Refused to leave it in a safe place and marked as delivered. Pure theft,2021-03-26 11:43,{1: 'Bad'}
605dbea9f85d750870361d46,605dbea52989d9001a62241c,Terrible experience,"Hi team,Unfortunately yesterday I experienced very poor service from your employee Tiffany.I ordered from Pizza Hut and the delivery driver didn’t deliver my Nachos with my order.When I had noticed they were not there, I looked on your app and couldn’t find a way to contact the rider, so I went google and called up your customer service.This all happened within a minute of my order being delivered, i called up and was put through to Tiffany, who told me not to worry because she would get it sorted for me.She said she’ll try to get it re-delivered put me on hold for a few minutes and then told me she couldn’t re-deliver it. She then told me that she would refund me £5.99 so I could re-order it, however I let her know £5.99 would cover the food but not delivery and service which I had already paid for initially when I ordered the food, so I wouldn’t be able to get it delivered for that price.After 5 minutes of arguing with me, she said she’ll speak to someone and put me on hold again for a few minutes, and then told me she could refund the delivery fee but not the service fee, I told her this is still unacceptable since I still would not be able to get the food delivered for that price.I then asked her why she couldn’t call the delivery driver and ask him if he could deliver the food if he still had it and she told me that it’s been 20 minutes now and the food would be bad quality. Which was terrible because the food that was sitting on the table had been there for 20 minutes while I was on the phone with her. If she had come up with that resolution in the first place when I had called her, it would have been good quality food and arrived a minute later than expected.The reason I got so annoyed in the first place is that I  only ordered from Pizza Hut for the nachos, the rest of it I didn’t care about that much. I would’ve ordered elsewhere if I knew I wouldn’t get the nachos.Overall very dissatisfied with the service, not only did I not get the nachos, I didn’t get the bare minimum refund so I could re-order them. Honestly after the inconvenience you would expect a good will gesture not an argument.Regards,Sean",2021-03-26 10:59,{1: 'Bad'}
605da8f2f85d75087035e570,605da8ed2d361e0019c58cb4,The bad reviews are real!!!,"Someone decided to use my deliveroo account to buy themselves food. After notifying deliveroo about my situation they said I need to email customer service and wait for a response for 24/48 hours. It’s been 2 weeks and my issue still hasn’t been resolved. If you call them or chat live with them, they won’t help you they will tell you to email deliveroo customer service and your issue will be left hanging. Then I asked them if they could unfreeze my app because I still had active credits on my account, no response from them on email nor any help on the phone. I wish I could post a picture of the chat log I had with deliveroo, and their process of talking to you is through copy and paste messages. If they see you keep trying to flag up an issue they will send a copy and paste message saying email customer service and they would leave the chat promptly. LOL it’s a joke!!",2021-03-26 09:27,{1: 'Bad'}
605d183ff85d750870356fa3,605d18392f9b2c00197cf8fe,Absolutely appalling service,Absolutely appalling service.  Accepted order even though no availability drivers.   Then cancel order 2 hours later.  Then blame the restaurant as they want to close,2021-03-25 23:09,{1: 'Bad'}
605d065ef85d750870355ad7,5ab233604de5666d34123367,Deliveroo offers voucher for my missing item no refund!,"I get my order incomplete and Deliveroo offers a voucher for my money that expires in 3 months still of giving the refund for the missing item, for sure this is illegal and is not a good business practice",2021-03-25 21:53,{1: 'Bad'}
605c3b8ef85d75087033765c,605c39cb1f9c8e0019901c0e,I am a driver for Deliveroo and I…,I am a driver for Deliveroo and I haven’t gotten paid for the previous week.This company should not exist.,2021-03-25 07:28,{1: 'Bad'}
605bdecdf85d7508703341be,605bdec41f9c8e00199002e7,Don't use this site,"Don't use this site. If you order once they get hold of all information and start deducting it from your account. I am from Canada and ordered once for my sister in UK. The following month they deducted $20.36 in my card. I did not notice it until after a few months. I contacted them and they asked for more information. I was hoping they will refund the $255 total billed from my account but they just said they cannot trace it. If you asked to give you a contact person to dispute it they'll just ignore you. So please, be careful. Check your account right away or better not use them for any delivery service.",2021-03-25 00:52,{1: 'Bad'}
605b971af85d75087032e3c2,605b97120d883d00199cd6e0,Dishonest and untrustworthy,Dishonest and untrustworthy. My 15 year old son made a mistake by one house number. No help from deliveroo as the driver marked delivered even though we know the neighbour turned it away as the wrong address. No call to check with my son. The driver took his food and deliveroo his money. Deliveroo said as it was his mistake they were not interested. Well they got his money after all! Glad this Dishonest company was happy to take a 15 year olds money and do nothing about this Dishonest thief of a delivery driver! Beware!,2021-03-24 19:46,{1: 'Bad'}
605b93aaf85d7507e42007ff,5d139213be59e855f9dd560f,Missing items all the time …,Now had three consecutive orders through their ‘grocery’ service and consistently missing items. Have tried to claim refunds for missing items. No response. Never known a system like this and feels like it encourages deception and mismanagement. £4-5 per order adds up to a huge amount of money per day just based on the number of orders they fulfil. I will cancel my deliveroo plus and avoid in future,2021-03-24 19:31,{1: 'Bad'}
605b7e40f85d75087032c377,5e5d417457843093a6aa55c4,Constantly get late food which usually…,Constantly get late food which usually means cold food. The drivers always pick up More than one delivery which they tell you but I’m always last get mine. I’ve talked to customer service but there useless they don’t take on board the issue and they don’t give you a refund they just go quiet and pretend they don’t get your email. Avoid!,2021-03-24 18:00,{1: 'Bad'}
605b70b1f85d7507e41fd974,5f5ff08b14844e106ca07c18,I am writing mainly for the reason that…,"I am writing mainly for the reason that today a Deliveroo driver almost knocked me over on a pedestrian street. They didn‘t look left nor right and kept on cycling wherever they want. I get the drivers want to be as fast as possible and are under time pressure, but it‘s a huge safety hazard because the cyclist usually come out of the middle of nowhere, they are quick and usually don‘t even see or watch out for pedestrians. For the service: ordered twice, the drivers were always friendly and thankful about tips. Once though we waited for four hours because the delivery vehicle broke down and they had to place a new order. That was a bummer, but the food was worth it. And to be fair, a competent Asian woman immediately called and there was transparency, but I‘d rather this did not happen. I would get a Deliveroo subscription, because they do have more restaurants than Justeat. My main concern though are the cyclists who don‘t care for human lives. Tell me who pays the hospital fees if I get run over and the cyclist just moves on with life and I never find out their name?",2021-03-24 17:02,{2: 'Poor'}
605b60d3f85d7507e41fc219,5fb268472f2525001a80f7a7,Various problems,"Food was delivered over half an hour late, stone cold. The driver was sadly unable to speak any English, so I was not able to explain to him how to find our office, even though I was  told he was only 1 minute away for that half hour. When I contacted the service team on Live Chat I was cut off twice for not typing fast enough, and each representative had no access to the previous live chats.I eventually rang customer services where I was told they had no access to the live chats I had been on. A really dispiriting process, and for me, alas,  the last time I use their service.",2021-03-24 15:54,{1: 'Bad'}
605b33bcf85d750870325d8e,53b5c72300006400017cff23,Deliveroo takes any opportnity to rip…,Deliveroo takes any opportnity to rip you off.   The app says - add tyo your order to get free delivery...and then you add and it doesnt remove the delivery fee.   When you complain to custoimer service they just blank you and make it your fault. I will Never EVER  order from Deliveroo again,2021-03-24 12:42,{1: 'Bad'}
605a8488f85d7507e41f1574,605a8457780813001452a7df,Giving one star is generous,Giving one star is generous! By far the worst company and customer service Iv come across. Abrupt staff and you go round and round in circles trying to resolve an issue with no outcome. Save your money and use another service ubereats instead.,2021-03-24 00:15,{1: 'Bad'}
605a6081f85d75087031d939,605a607cb68cb800134a28c2,Greedy Company.,"Service has really gone downhill. Ordered a meal that cost £10 and fees came to an extra £10. Delivery drivers get paid a pittance though, so not sure where that money is going. Nver mind the fact that the restaurant I was ordering from was only 2 miles(!) away. Such a shame as I ordered frequently before the people behind this company became so greedy.",2021-03-23 21:41,{1: 'Bad'}
